{
  "$schema": "https://json-schema.org/draft/2020-12/schema",
  "$id": "https://vivodepot.de/schemas/situation-modul-schema.json",
  "title": "Vivodepot Situations-Modul",
  "description": "Ein Situations-Modul bringt eigene Situationen (Anlässe) mit: Kennung → Titel, Symbol und Blöcke mit Zeigern auf bestehende Felder. Maßstab ist der Kern: situationsModulPruefen in vivodepot.html; die Probe tests/mit-modul/modul-schema-situation.test.js hält Schema und Kern im Gleichlauf. Ein Modul, das dieses Schema erfüllt, ist der Form nach sauber. Ob eine Kennung schon von einer eingebauten Situation belegt ist, prüft nur der Kern: solche Situationen verwirft er einzeln, und ein Modul, von dem nichts übrig bleibt, lehnt er ab (Grund `leer`).",
  "type": "object",
  "additionalProperties": false,
  "required": ["moduleVersion", "herkunft", "situationen", "sprache"],
  "properties": {
    "modulTyp": { "const": "situation" },
    "moduleVersion": { "description": "Fassung des Moduls, ganzzahlig ab 1.", "type": "integer", "minimum": 1 },
    "herkunft": { "description": "Anbieter-Kennung des Moduls, nicht leer.", "type": "string", "pattern": "\\S" },
    "sprache": {
      "description": "Sprache der Titel (BCP-47-Form, z. B. `de`, `en-GB`). Pflicht, weil jede Situation einen Titel trägt.",
      "type": "string",
      "pattern": "^\\s*[a-z]{2,3}(-[A-Za-z0-9]{2,8})*\\s*$"
    },
    "situationen": {
      "description": "Kennung → Situation. Kennung: Kleinbuchstabe am Anfang, dann Kleinbuchstaben, Ziffern, Bindestrich, 2 bis 40 Zeichen.",
      "type": "object",
      "minProperties": 1,
      "propertyNames": { "pattern": "^[a-z][a-z0-9-]{1,39}$" },
      "additionalProperties": { "$ref": "#/$defs/situation" }
    },
    "appVersion": { "description": "Vom Einlass gesetzt.", "type": "string" },
    "ungeprueft": { "description": "Vom Einlass gesetzt.", "type": "boolean" },
    "eingelassenAm": { "description": "Vom Einlass gesetzt.", "type": "string" },
    "anbieterId": { "description": "Vom Einlass gesetzt.", "type": "string" },
    "anbieterIdGeprueft": { "description": "Vom Einlass gesetzt.", "type": "boolean" }
  },
  "$defs": {
    "situation": {
      "type": "object",
      "required": ["titel"],
      "properties": {
        "titel": { "description": "Titel der Situation, nicht leer.", "type": "string", "pattern": "\\S" },
        "icon": { "description": "Name eines Kern-Symbols; ein unbekannter Name wird verworfen und durch `star` ersetzt.", "type": "string" },
        "bloecke": {
          "description": "Blöcke mit Zeigern {quelle, feld} auf bestehende Felder. Ein eigenes Feld-Objekt ist hier nicht erlaubt.",
          "type": "array",
          "items": {
            "type": "object",
            "required": ["eintraege"],
            "properties": {
              "eintraege": {
                "type": "array",
                "items": {
                  "type": "object",
                  "required": ["quelle", "feld"],
                  "properties": {
                    "quelle": { "description": "Bereichs-Kennung.", "type": "string" },
                    "feld": { "description": "Feld-Kennung im Bereich.", "type": "string" }
                  }
                }
              }
            }
          }
        }
      }
    }
  }
}
